<?xml version="1.0" encoding="UTF-8"?>
<dataroot xmlns:od="urn:schemas-microsoft-com:officedata" xmlns:xsi="http://www.w3.org/2001/XMLSchema-instance"  xsi:noNamespaceSchemaLocation="Enemy.xsd" generated="2014-12-16T23:55:12">
<Enemy>
<ID>EN01</ID>
<Name>Slime</Name>
<HP>10</HP>
<MP>15</MP>
<STR>10</STR>
<END>5</END>
<MAG>10</MAG>
<AGI>8</AGI>
<ACC>5</ACC>
<Level>1</Level>
<EXP>500</EXP>
<Gold>12</Gold>
<Element>Water</Element>
</Enemy>
<Enemy>
<ID>EN02</ID>
<Name>Zombie</Name>
<HP>10</HP>
<MP>20</MP>
<STR>10</STR>
<END>5</END>
<MAG>15</MAG>
<AGI>10</AGI>
<ACC>10</ACC>
<Level>2</Level>
<EXP>500</EXP>
<Gold>15</Gold>
<Element>Dark</Element>
</Enemy>
<Enemy>
<ID>EN03</ID>
<Name>Ghost</Name>
<HP>10</HP>
<MP>30</MP>
<STR>10</STR>
<END>5</END>
<MAG>65</MAG>
<AGI>17</AGI>
<ACC>14</ACC>
<Level>3</Level>
<EXP>500</EXP>
<Gold>20</Gold>
<Element>Wind</Element>
</Enemy>
<Enemy>
<ID>EN04</ID>
<Name>Lightning Tiger</Name>
<HP>120</HP>
<MP>40</MP>
<STR>70</STR>
<END>30</END>
<MAG>35</MAG>
<AGI>40</AGI>
<ACC>20</ACC>
<Level>4</Level>
<EXP>29</EXP>
<Gold>40</Gold>
<Element>Electric</Element>
</Enemy>
<Enemy>
<ID>EN05</ID>
<Name>Mad Rider</Name>
<HP>150</HP>
<MP>50</MP>
<STR>90</STR>
<END>40</END>
<MAG>20</MAG>
<AGI>20</AGI>
<ACC>13</ACC>
<Level>5</Level>
<EXP>31</EXP>
<Gold>50</Gold>
<Element>Neutral</Element>
</Enemy>
<Enemy>
<ID>EN06</ID>
<Name>Zombie Dragon</Name>
<HP>270</HP>
<MP>60</MP>
<STR>90</STR>
<END>25</END>
<MAG>105</MAG>
<AGI>30</AGI>
<ACC>20</ACC>
<Level>6</Level>
<EXP>35</EXP>
<Gold>75</Gold>
<Element>Dark</Element>
</Enemy>
<Enemy>
<ID>EN07</ID>
<Name>Angel</Name>
<HP>220</HP>
<MP>70</MP>
<STR>80</STR>
<END>35</END>
<MAG>100</MAG>
<AGI>40</AGI>
<ACC>50</ACC>
<Level>7</Level>
<EXP>40</EXP>
<Gold>100</Gold>
<Element>Light</Element>
</Enemy>
<Enemy>
<ID>EN08</ID>
<Name>Dullahan</Name>
<HP>320</HP>
<MP>80</MP>
<STR>200</STR>
<END>50</END>
<MAG>120</MAG>
<AGI>60</AGI>
<ACC>80</ACC>
<Level>8</Level>
<EXP>92</EXP>
<Gold>150</Gold>
<Element>Dark</Element>
</Enemy>
<Enemy>
<ID>EN09</ID>
<Name>Cool Jack</Name>
<HP>300</HP>
<MP>90</MP>
<STR>120</STR>
<END>40</END>
<MAG>100</MAG>
<AGI>65</AGI>
<ACC>40</ACC>
<Level>8</Level>
<EXP>83</EXP>
<Gold>140</Gold>
<Element>Fire</Element>
</Enemy>
<Enemy>
<ID>EN10</ID>
<Name>Scale of Ice</Name>
<HP>400</HP>
<MP>100</MP>
<STR>100</STR>
<END>65</END>
<MAG>30</MAG>
<AGI>35</AGI>
<ACC>30</ACC>
<Level>8</Level>
<EXP>78</EXP>
<Gold>130</Gold>
<Element>Water</Element>
</Enemy>
<Enemy>
<ID>EN11</ID>
<Name>Mad Jotun</Name>
<HP>500</HP>
<MP>110</MP>
<STR>200</STR>
<END>80</END>
<MAG>250</MAG>
<AGI>30</AGI>
<ACC>20</ACC>
<Level>9</Level>
<EXP>156</EXP>
<Gold>200</Gold>
<Element>Fire</Element>
</Enemy>
<Enemy>
<ID>EN12</ID>
<Name>Igna</Name>
<HP>8000</HP>
<MP>1000</MP>
<STR>350</STR>
<END>120</END>
<MAG>280</MAG>
<AGI>60</AGI>
<ACC>70</ACC>
<Level>10</Level>
<EXP>1300</EXP>
<Gold>2000</Gold>
<Element>Neutral</Element>
</Enemy>
<Enemy>
<ID>EN13</ID>
<Name>Xelvaria</Name>
<HP>6000</HP>
<MP>1000</MP>
<STR>260</STR>
<END>80</END>
<MAG>370</MAG>
<AGI>90</AGI>
<ACC>80</ACC>
<Level>10</Level>
<EXP>1100</EXP>
<Gold>1700</Gold>
<Element>Neutral</Element>
</Enemy>
<Enemy>
<ID>EN14</ID>
<Name>Fei Long</Name>
<HP>7000</HP>
<MP>1000</MP>
<STR>380</STR>
<END>100</END>
<MAG>380</MAG>
<AGI>70</AGI>
<ACC>100</ACC>
<Level>10</Level>
<EXP>1100</EXP>
<Gold>1700</Gold>
<Element>Neutral</Element>
</Enemy>
<Enemy>
<ID>EN15</ID>
<Name>Odin</Name>
<HP>30000</HP>
<MP>5000</MP>
<STR>400</STR>
<END>50</END>
<MAG>350</MAG>
<AGI>50</AGI>
<ACC>150</ACC>
<Level>10</Level>
<EXP>5000</EXP>
<Gold>5000</Gold>
<Element>Neutral</Element>
</Enemy>
</dataroot>
